{
  "schemaVersion": "0.2.0",
  "eventId": "b542ba66-34e7-4778-942f-6e5177a75002",
  "eventType": "observation",
  "occurredAt": "2026-09-08T02:00:00Z",
  "recordedAt": "2026-09-08T02:00:02Z",
  "learnerRef": "psn_e001_001",
  "observer": {
    "id": "e001-research-instrument",
    "type": "instrument",
    "captureMethod": "mixed",
    "profileVersion": "0.2.0"
  },
  "objective": {
    "id": "objective-phishing-triage",
    "version": "1.0.0",
    "targetCapability": "identify and safely escalate suspicious messages"
  },
  "task": {
    "id": "phishing-triage",
    "version": "1.0.0",
    "formId": "transfer-form-c",
    "trialId": "followup-004",
    "rubricVersion": "1.0.0",
    "conditions": {
      "deliveryMode": "online",
      "language": "en-AU",
      "timeLimitSeconds": 900,
      "resourcePolicyVersion": "accessible-independent-1.0.0"
    }
  },
  "evidenceLane": "accessible-independent",
  "assistanceEnvelope": {
    "accessibleBaseline": ["screen-reader", "keyboard-navigation"],
    "functions": ["access-restoration"],
    "toolsAllowed": ["screen-reader"],
    "toolsAvailable": ["screen-reader"],
    "toolsDeclaredUsed": ["screen-reader"],
    "toolsObservedUsed": ["screen-reader"],
    "useEvidenceBasis": "mixed",
    "classificationStatus": "learner-confirmed",
    "classificationAssertedBy": "e001-research-instrument",
    "substantiveGenerationState": "not-available"
  },
  "stewardshipActions": ["none-observed"],
  "outcome": {
    "scoringStatus": "scored",
    "score": 1,
    "correctness": "correct",
    "severityWeightedError": 0,
    "scoringAssertion": {
      "assertedBy": "e001-authored-rubric-scorer",
      "rubricVersion": "1.0.0",
      "evidenceRuleVersion": "phishing-triage-rule-1.0.0",
      "scoredAt": "2026-09-08T02:00:03Z"
    },
    "delaySeconds": 604800,
    "timeHorizon": "delayed",
    "transferDistance": "near",
    "supportState": "accessible-independent"
  },
  "accessibility": {
    "accessSupportsPreserved": true,
    "classificationReviewedByLearner": true
  },
  "governance": {
    "collectionPurpose": "E001 research pilot",
    "stakes": "low",
    "permittedUses": ["pilot-analysis", "learner-review", "instrument-improvement"],
    "prohibitedUses": ["learner-ranking", "credentialing", "employment-decision", "silent-mastery-update", "diagnosis"],
    "consentVersion": "e001-consent-1.0.0",
    "learnerVisible": true,
    "contestable": true,
    "retentionUntil": "2027-03-08T00:00:00Z"
  }
}
